,wav_filename,wav_filesize,transcript
2458,common_voice_pt_19450776.wav,90668,apenas use o telefone
4332,common_voice_pt_19586450.wav,63788,um homem
2103,common_voice_pt_19422067.wav,161324,eu gosto de como o atom me permite instalar novos plugins
4386,common_voice_pt_19738966.wav,186668,dois homens dançam juntos enquanto uma multidão os anima
3427,common_voice_pt_19436004.wav,80684,perdendo tempo
2999,common_voice_pt_19433431.wav,165164,guarda chuvas e lixo sentado em um quarto bagunçado
1576,common_voice_pt_19415851.wav,107564,banco comercial cathay pacific
1144,common_voice_pt_19409793.wav,126764,houve um som de folhas secas do lado de fora
1467,common_voice_pt_19415674.wav,175148,um cão branco com manchas pretas está saltando sobre uma cerca branca
4192,common_voice_pt_19573476.wav,113708,a biblioteca está aberta a todos
2304,common_voice_pt_19428271.wav,99884,isso não é para eu decidir
4144,common_voice_pt_19564773.wav,182828,um rapaz usando sapatos brancos perseguindo várias galinhas
3946,common_voice_pt_19503720.wav,186668,james madison e james monroe foram presidentes do estados unidos
968,common_voice_pt_19403685.wav,153644,várias pessoas estão vestidas com roupas indianas
1290,common_voice_pt_19410229.wav,130604,há uma caravana saindo hoje para al fayoum
583,common_voice_pt_19302013.wav,117548,um conceito assustador ocorreu a jennifer
2894,common_voice_pt_19433086.wav,145964,um cachorro marrom parado no meio de um enorme campo
3722,common_voice_pt_19441861.wav,126764,dois meninos correndo em uma roda de metal gigante
1964,common_voice_pt_19416454.wav,106028,feliz expressão em seu rosto
840,common_voice_pt_19317942.wav,79148,não podemos melhorar
2124,common_voice_pt_19422098.wav,94508,foi uma surpresa para mim
4193,common_voice_pt_19573477.wav,129068,uma criança que faz um castelo da areia na praia
2658,common_voice_pt_19528898.wav,73004,não estava lá
2569,common_voice_pt_19469169.wav,134444,lisa e eu somos bons amigos
3265,common_voice_pt_19435516.wav,178988,um homem sem camisa e um homem em uma colete azul de pesca
3621,common_voice_pt_19441387.wav,102188,queremos alguma ação nessas fotos
973,common_voice_pt_19403692.wav,148268,um jovem rapaz mostra suas pequenas figuras de ação
22,common_voice_pt_19277098.wav,138284,pegue a partida e bata contra o seu sapato
2342,common_voice_pt_19428332.wav,109868,não houve festa na escola este ano
4188,common_voice_pt_19573465.wav,188204,um jovem está tirando uma foto de uma mulher em uma doca
3829,common_voice_pt_19442144.wav,132908,motociclista tocando enquanto dois homens assistem
3567,common_voice_pt_19441255.wav,98348,eu vou pará lo frio
2784,common_voice_pt_19432839.wav,159788,o ladino está comemorando seu triunfo
3237,common_voice_pt_19435481.wav,140588,os requisitos são bastante altos para este trabalho
2413,common_voice_pt_19450562.wav,142124,diga a si mesmo para acreditar em si mesmo
254,common_voice_pt_19284301.wav,86828,ela não respondeu nada
848,common_voice_pt_19318239.wav,271148,ele olhou para a praça vazia novamente sentindo se menos desesperado do que antes
399,common_voice_pt_19290628.wav,71468,o que é comunidade
2955,common_voice_pt_19433299.wav,73004,está chegando
3449,common_voice_pt_19439256.wav,145964,mãe e filho se divertindo comendo à beira do lago
2748,common_voice_pt_19798001.wav,119084,uma criança brincando na neve
2451,common_voice_pt_19450730.wav,102188,a cisterna estava com defeito
2902,common_voice_pt_19433096.wav,130604,não houve resposta dos anciãos
3331,common_voice_pt_19435707.wav,178988,todo mundo na terra tem um tesouro que o aguarda seu coração disse
2463,common_voice_pt_19450788.wav,215084,este post vai te ensinar como configurar o ambiente básico de reconhecimento de voz
3141,common_voice_pt_19435290.wav,132908,mas o comerciante de cristal não tinha escolha
298,common_voice_pt_19284743.wav,122924,mas aqui está a parte mais engraçada de tudo
1876,common_voice_pt_19416321.wav,53804,é justo
4126,common_voice_pt_19564708.wav,149804,o jogador de beisebol dá um soco na bola
4499,common_voice_pt_19783530.wav,142124,homens que estão em um campo com um cão
3698,common_voice_pt_19441793.wav,148268,um homem está na cintura em um rio lançando uma rede
2240,common_voice_pt_19428178.wav,115244,coma um grito de barriga de pudim
2285,common_voice_pt_19428246.wav,99884,quem pode ser dono da verdade
3423,common_voice_pt_19435997.wav,157484,eu sou o editor da cidade apenas no nome
4418,common_voice_pt_19755305.wav,218924,mulheres e homens são iguais em dignidade assim como em direitos e deveres
1651,common_voice_pt_19415951.wav,80684,por que isso é importante
1773,common_voice_pt_19416152.wav,109868,ainda não pode contatar conway
2473,common_voice_pt_19450820.wav,145964,o árabe é escrito da direita para a esquerda
484,common_voice_pt_19291531.wav,109868,insira seu cartão para se identificar
3060,common_voice_pt_19435094.wav,90668,vire a direita
1248,common_voice_pt_19410150.wav,126764,flores ou outra assinatura de revista
3010,common_voice_pt_19434913.wav,149804,ela não conseguia encontrar um cesto de lixo
103,common_voice_pt_19278217.wav,86828,não me pergunte como eu sei
480,common_voice_pt_19291429.wav,140588,é quando ele estará em segurança e nem um minuto antes
3888,common_voice_pt_19484581.wav,167468,um homem que joga o pingue pongue quando uma criança olhar
1904,common_voice_pt_19416363.wav,176684,um homem está ao ar livre lavar o carro com sabão e água
3804,common_voice_pt_19442084.wav,98348,pode guardar isso na geladeira
465,common_voice_pt_19291138.wav,94508,depois de terminar o assunto
2825,common_voice_pt_19432949.wav,245804,o alquimista parou abruptamente e se debruçou no chão
2245,common_voice_pt_19428184.wav,178988,o grupo de jovens adultos está saindo juntos fumando e bebendo
1073,common_voice_pt_19409655.wav,138284,um homem em volta chutando outro homem em um ringue
66,common_voice_pt_19277258.wav,144428,um homem de terno se afasta de um prédio com longas sombras
567,common_voice_pt_19301863.wav,113708,sua conexão com a internet era muito lenta
466,common_voice_pt_19291139.wav,138284,marty ajudou a capturar a ponte remagen
3323,common_voice_pt_19435684.wav,152108,um homem sentado contra painéis de madeira
920,common_voice_pt_19403509.wav,167468,um cão marrom com um colarinho preto fica ao lado de um arbusto
425,common_voice_pt_19290748.wav,122924,uma pessoa está falando ao ar livre em um microfone
950,common_voice_pt_19403628.wav,84524,em duas horas haverá um debate
1099,common_voice_pt_19409700.wav,117548,determine se esta carta é importante
2226,common_voice_pt_19422587.wav,184364,agora eu estou começando o que eu poderia ter começado dez anos atrás
2012,common_voice_pt_19416593.wav,129068,toque alguma música da selena gomez
3803,common_voice_pt_19442083.wav,102188,site de inscrições e eventos
2102,common_voice_pt_19422066.wav,121388,ouça não acredite no que ele diz
2219,common_voice_pt_19422400.wav,107564,eu juro no túmulo da minha mãe
3902,common_voice_pt_19484997.wav,145964,adicionando rapidamente leva a quantias erradas
1977,common_voice_pt_19416476.wav,117548,não havia necessidade de abordar o assunto
2416,common_voice_pt_19450572.wav,79148,carlos alberto
3636,common_voice_pt_19441413.wav,167468,ela tentou parar o sangramento de suas coxas com um lenço de papel
894,common_voice_pt_19327916.wav,134444,os sem teto parecem gostar de sopa
2419,common_voice_pt_19450585.wav,86828,eu me virei para ela
4274,common_voice_pt_19586190.wav,106028,faça pouca atenção
1062,common_voice_pt_19403937.wav,140588,uma menina está andando em um recipiente de lixo
3671,common_voice_pt_19441725.wav,142124,em todos os lugares havia barracas com itens à venda
1985,common_voice_pt_19416516.wav,132908,a sentença foi muito curta disse o advogado
3302,common_voice_pt_19435560.wav,161324,um homem que trabalha com uma ferramenta de soldagem
683,common_voice_pt_19307937.wav,132908,ela permitiu que ele a guiasse pela calçada
1756,common_voice_pt_19416126.wav,134444,as ruas são estreitas e cheias de curvas fechadas
2108,common_voice_pt_19422074.wav,268844,os cidadãos das áreas afetadas pelo tufão são aconselhados a deixar suas casas imediatamente
3762,common_voice_pt_19441944.wav,122924,em um tom de voz ou sussurro
2907,common_voice_pt_19433116.wav,209708,um casal inspeciona frutas e vegetais atrás de uma tela protetora de plástico
2298,common_voice_pt_19428265.wav,134444,segurança leve esse cara embora
360,common_voice_pt_19290422.wav,76844,deve haver algum jeito
860,common_voice_pt_19318320.wav,149804,ele poderia vender as pedras e comprar uma passagem de volta
1098,common_voice_pt_19409699.wav,94508,a linha se forma à direita
2723,common_voice_pt_19715660.wav,149804,noventa e cinco linhas e não mais é isso
1686,common_voice_pt_19416028.wav,79148,não ele não tinha
3077,common_voice_pt_19435135.wav,171308,se uma pessoa está vivendo seu destino ele sabe tudo o que precisa saber
348,common_voice_pt_19284913.wav,98348,toque alguma música do green day
3400,common_voice_pt_19435920.wav,119084,ele estava planejando quando saiu do bar
3669,common_voice_pt_19441722.wav,172844,um homem em uma veste alaranjada que está sobre uma construção
1631,common_voice_pt_19415927.wav,119084,não há mais nada que possamos fazer hoje à noite
531,common_voice_pt_19301499.wav,152108,e jesus disse chamarás isto de bolacha e não de biscoito
3253,common_voice_pt_19435500.wav,126764,segurando o saco de papel com dinheiro
3642,common_voice_pt_19441421.wav,98348,o menino conheceu o alquimista
2588,common_voice_pt_19493400.wav,157484,não atravesse suas pontes até chegar a elas
519,common_voice_pt_19301430.wav,122924,os infiéis tinham um olhar maligno sobre eles
4483,common_voice_pt_19755525.wav,126764,o cão nada em direção a uma cachoeira
1383,common_voice_pt_19410413.wav,82988,vamos ajudar as crianças primeiro
3909,common_voice_pt_19485106.wav,213548,mulheres em uma competição de natação de revezamento estão decolando da linha de largada
1704,common_voice_pt_19416051.wav,80684,não há doces no lado negro
3148,common_voice_pt_19435303.wav,121388,deixe me dizer o que vai acontecer
2106,common_voice_pt_19422072.wav,142124,um homem e uma mulher vestindo vermelho abraçando
3329,common_voice_pt_19435702.wav,129068,como é que algo assim começa a aparecer
3536,common_voice_pt_19441180.wav,142124,eu perguntei a alguém ao meu redor que eu ouvi isso
3515,common_voice_pt_19441133.wav,132908,um jovem asiático está na frente de uma classe
4500,common_voice_pt_19783537.wav,155948,aqui está uma explicação de por que não há ninguém
98,common_voice_pt_19278189.wav,80684,atitude otimista
3383,common_voice_pt_19435868.wav,96044,nenhuma doença é incurável
2509,common_voice_pt_19457629.wav,121388,deixe o saber que ele está discutindo
1167,common_voice_pt_19409839.wav,103724,desça para jantar este minuto
569,common_voice_pt_19301878.wav,88364,deixe me emprestá la primeiro
593,common_voice_pt_19302132.wav,121388,em que ano essa música foi lançada
1819,common_voice_pt_19416212.wav,148268,um homem com uma camisa verde está segurando uma planta
2538,common_voice_pt_19457883.wav,142124,há rumores de guerras tribais disse ele
1701,common_voice_pt_19416048.wav,126764,alguns meninos estão no palco apontando para o céu
4374,common_voice_pt_19738901.wav,178988,dois homens de short e mangas curtas saltam no ar
3129,common_voice_pt_19435276.wav,80684,mas o que é tudo isso
1716,common_voice_pt_19416070.wav,132908,o capitão falou em voz alta sobre o ocorrido
4291,common_voice_pt_19586261.wav,188204,um grupo de homens sentados em torno de uma mesa que tem garrafas vazias
3377,common_voice_pt_19435856.wav,115244,um homem de camisa rosa cruza as pernas
1208,common_voice_pt_19409920.wav,107564,o técnico não conseguiu descobrir o erro
2918,common_voice_pt_19433143.wav,84524,eu tremia de emoção
1717,common_voice_pt_19416072.wav,98348,eu não te conheço de adam
1036,common_voice_pt_19403885.wav,94508,eu enterraria no jardim
594,common_voice_pt_19302134.wav,98348,eu estou acostumada com o chefe
3298,common_voice_pt_19435555.wav,121388,ele ainda toca a criança de vez em quando
842,common_voice_pt_19317948.wav,136748,eu estou procurando a possibilidade de saltar
1501,common_voice_pt_19415732.wav,59948,fala sério
4022,common_voice_pt_19533475.wav,84524,mas ele não parou
1227,common_voice_pt_19409956.wav,167468,veja que a srta baker consegue um carro para levá la para casa
3895,common_voice_pt_19484955.wav,182828,uma mulher desliza para casa enquanto o apanhador tenta bloquear
1494,common_voice_pt_19415720.wav,103724,eu o rasguei em pedaços
3887,common_voice_pt_19484577.wav,153644,diga lhes para começar a tirar esses extras
2273,common_voice_pt_19428233.wav,157484,receio que este evento seja apenas por convite senhor
139,common_voice_pt_19278399.wav,82988,precisamos de mais sabão
1347,common_voice_pt_19410338.wav,94508,um homem com a mão levantada
1637,common_voice_pt_19415934.wav,99884,eu tinha visto tudo o que isso me traria
3808,common_voice_pt_19442096.wav,80684,o grupo era muito unido
1703,common_voice_pt_19416050.wav,107564,duas mulheres jogam voleibol na areia
4167,common_voice_pt_19570584.wav,225068,vários músicos estão posicionados ao redor do baterista e a escada em um palco
3071,common_voice_pt_19435118.wav,106028,existem estrelas brilhantes no céu
1005,common_voice_pt_19403823.wav,103724,e ela ficou ali mortificada
3458,common_voice_pt_19440977.wav,218924,tecnologia esse ano novos meios de conexão serão lançados
1965,common_voice_pt_19416457.wav,130604,o psicopata geralmente tem alucinações
1519,common_voice_pt_19415764.wav,80684,no tempo correto musical
3099,common_voice_pt_19435200.wav,107564,pois claro eu disse isso
3082,common_voice_pt_19435150.wav,99884,fechar o firefox
1634,common_voice_pt_19415931.wav,82988,o conflito não foi resolvido
2350,common_voice_pt_19428349.wav,111404,faz sentido ter pesos negativos
2331,common_voice_pt_19428311.wav,126764,lembre me de acordar amanhã às oito da manhã
3752,common_voice_pt_19441923.wav,80684,quem escreveu este livro
4307,common_voice_pt_19586380.wav,122924,eu quero ouvir foreign affair
1779,common_voice_pt_19416159.wav,190508,o menino alcançou a pequena igreja abandonada quando a noite estava caindo
1064,common_voice_pt_19409641.wav,182828,uma mulher de preto caminha pela rua em frente a uma parede grafitada
2650,common_voice_pt_19522003.wav,165164,eu uso o firefox como navegador principal
3218,common_voice_pt_19435451.wav,144428,ao mesmo tempo ele conectou os dois incidentes
1410,common_voice_pt_19415559.wav,88364,amanhã é quarta feira
3021,common_voice_pt_19434942.wav,195884,ana júlio juliana e josé foram ao evento na quinta
3851,common_voice_pt_19455578.wav,142124,um esquiador com um casaco vermelho descendo uma colina
2343,common_voice_pt_19428336.wav,79148,eu sei o que vai ser
1402,common_voice_pt_19415545.wav,130604,algumas pessoas andam em uma calçada cinza
2264,common_voice_pt_19428210.wav,96044,a cidade toda ficou louca
536,common_voice_pt_19301538.wav,98348,canal e armazém de otaru
1320,common_voice_pt_19410278.wav,109868,a empresa criou um ambiente para colaboração
3446,common_voice_pt_19439251.wav,103724,há ouro aqui ele disse
847,common_voice_pt_19318237.wav,94508,essa parte é fácil
1212,common_voice_pt_19409924.wav,71468,o tolo é colhido
658,common_voice_pt_19307815.wav,171308,uma mulher cobrindo os olhos em um parque como o dia chega ao fim
3428,common_voice_pt_19436018.wav,140588,um homem faz um truque de salto em uma moto
41,common_voice_pt_19277183.wav,157484,o pinguim atravessa o gelo juntando se aos seus companheiros
1649,common_voice_pt_19415949.wav,159788,nossos comerciantes compraram aquele homem e o trouxeram para o egito
455,common_voice_pt_19291024.wav,98348,volte e compre dois pacotes
1426,common_voice_pt_19415592.wav,96044,o orgulho vem antes da queda
3641,common_voice_pt_19441420.wav,129068,o menino notou que a roupa do homem era estranha
1019,common_voice_pt_19403854.wav,75308,eles se reúnem
485,common_voice_pt_19291532.wav,82988,volte e ajude todos
1652,common_voice_pt_19415954.wav,157484,por sorte a adaga não conseguiu penetrar no colete à prova de balas
2857,common_voice_pt_19432992.wav,142124,um passo a mais e o conselho entrará em colapso
1871,common_voice_pt_19416314.wav,140588,uma criança pequena de camisa vermelha fica no meio da rua
3948,common_voice_pt_19503758.wav,119084,ai isso foi desnecessário
4086,common_voice_pt_19564531.wav,79148,ele fez muito
4432,common_voice_pt_19755333.wav,119084,casa de um homem é o seu castelo
3506,common_voice_pt_19441112.wav,125228,precisamos resolver esse problema rapidamente
3199,common_voice_pt_19435404.wav,84524,houve muito pouca conversa
3314,common_voice_pt_19435583.wav,182828,avançando lentamente eles procuraram entre as pedras
1785,common_voice_pt_19416167.wav,71468,oh o que é isso
323,common_voice_pt_19284797.wav,134444,ele viu o menino aparecer do outro lado das dunas
3043,common_voice_pt_19435049.wav,171308,estava tão camuflado que ninguém suspeitaria de sua presença
3136,common_voice_pt_19435284.wav,102188,ela aparentemente não escutou
4152,common_voice_pt_19570409.wav,192044,duas crianças estão se preparando para ir em um passeio de elefante
503,common_voice_pt_19301322.wav,202028,centenas de observadores viram a chama naquela noite e na noite seguinte
3657,common_voice_pt_19441479.wav,136748,feller corre nos meses de fevereiro
827,common_voice_pt_19317868.wav,109868,as legendas eram em espanhol
266,common_voice_pt_19284336.wav,167468,dotada de vários equipamentos para a prática de atividades
2037,common_voice_pt_19416629.wav,115244,a rede elétrica não tinha aterramento
3200,common_voice_pt_19435405.wav,138284,estou procurando o trailer de highlands today
2283,common_voice_pt_19428244.wav,155948,por que as pessoas ainda comem manteiga de amendoim e geléia
737,common_voice_pt_19314601.wav,59948,pare
2720,common_voice_pt_19588753.wav,172844,um homem está correndo um camelo como se fosse um cavalo
3918,common_voice_pt_19486180.wav,186668,um grupo de pessoas se reúne sob uma área coberta e coberta
1326,common_voice_pt_19410293.wav,107564,gerenciados de tarefas do windows
788,common_voice_pt_19317680.wav,159788,o tratado de tordesilhas queria dividir o novo mundo
3256,common_voice_pt_19435503.wav,69164,sim
2616,common_voice_pt_19498839.wav,195884,adicionar erik santos na minha lista de reprodução metal xplorer
4406,common_voice_pt_19754850.wav,165164,homem de camisa azul andando de bicicleta fumando um cigarro
3306,common_voice_pt_19435569.wav,205868,sem responder o guarda entrou na tenda onde permaneceu por algum tempo
489,common_voice_pt_19291559.wav,153644,um homem sem camisa com tatuagens está trabalhando em andaimes
3158,common_voice_pt_19435322.wav,142124,eu suponho que tudo isso está levando a algum lugar
4311,common_voice_pt_19586392.wav,132908,um menino está assistindo uma mulher
2023,common_voice_pt_19416611.wav,86828,esperando por décadas
618,common_voice_pt_19302952.wav,76844,o céu estava claro
313,common_voice_pt_19284775.wav,106028,o menino aproximou seu cavalo
1672,common_voice_pt_19416007.wav,52268,e se for
4138,common_voice_pt_19564756.wav,178988,escolas para senhoras ensinam charme e graça
4156,common_voice_pt_19570425.wav,169004,um homem está sentado em uma banca de jornal lendo um jornal
1407,common_voice_pt_19415556.wav,96044,quer andar para nova york
3041,common_voice_pt_19435037.wav,140588,o homem de camisa branca está segurando um menino
3401,common_voice_pt_19435921.wav,130604,um artista pintando a parede coberta de bambu
1868,common_voice_pt_19416305.wav,138284,a grama e os arbustos estavam molhados de orvalho
3297,common_voice_pt_19435554.wav,126764,ele estava apostando nesse resultado
3293,common_voice_pt_19435550.wav,130604,a casa do josé é bonita
918,common_voice_pt_19403505.wav,113708,eu não acho que seja o suficiente
4148,common_voice_pt_19564792.wav,178988,paul se desculpou com linda e abriu a porta
3592,common_voice_pt_19441338.wav,109868,por fim teve de se render
4002,common_voice_pt_19530807.wav,132908,e o murmúrio durou mais que um simples juramento
1681,common_voice_pt_19416020.wav,175148,ele se levantou ajustou sua roupa e pegou sua bolsa
716,common_voice_pt_19314538.wav,234284,servos iam e vinham com bandejas de prata carregadas de especiarias e chá
3495,common_voice_pt_19441080.wav,96044,espero dar espaço para isso
4240,common_voice_pt_19581762.wav,109868,a orquestra tem sua estréia hoje
1664,common_voice_pt_19415992.wav,140588,chad acena para eles e continua do outro lado da rua
1403,common_voice_pt_19415547.wav,99884,chamado um para comer juntos
2133,common_voice_pt_19422114.wav,132908,a fome é boa mostarda o melhor molho
3151,common_voice_pt_19435312.wav,119084,o sol estava muito quente neste verão
3966,common_voice_pt_19505535.wav,182828,nem todo mundo pode ver seus sonhos se tornando realidade da mesma maneira
1922,common_voice_pt_19416390.wav,122924,mas codificando sem mouse ou teclado
4149,common_voice_pt_19564793.wav,159788,uma mulher em uma camiseta verde fala em um microfone
3724,common_voice_pt_19441863.wav,92204,ainda tem muito tempo
1109,common_voice_pt_19409718.wav,119084,ele está vigiando a outra porta
4163,common_voice_pt_19570519.wav,245804,o plano ou esboço que facilita a localização geográfica de cada uma das performances
1249,common_voice_pt_19410151.wav,152108,adquirimos o quarterback de renúncias na última temporada
1355,common_voice_pt_19410350.wav,165164,estava amontoado em e ele mal pensara nisso há muito tempo
2265,common_voice_pt_19428211.wav,122924,e ele sabia que o egito estava na áfrica
2777,common_voice_pt_19432796.wav,202028,aquele cara ali gosta de beber muito fala muito mas não faz nada
21,common_voice_pt_19277097.wav,86828,a vista deveria valer a pena
2362,common_voice_pt_19428371.wav,186668,sua morte está registrada no departamento de guerra em washington
3923,common_voice_pt_19486315.wav,188204,silhueta de uma jovem mulher pulando e um belo cenário no fundo
839,common_voice_pt_19317940.wav,172844,o povo é contra a regulamentação do serviço de internet
1995,common_voice_pt_19416539.wav,129068,agora vou me afastar suavemente da terra dos sonhos
438,common_voice_pt_19290849.wav,80684,talvez tenha sido ontem
4060,common_voice_pt_19564267.wav,182828,uma menina está comendo cereal fora de uma tigela branca
4255,common_voice_pt_19581806.wav,169004,duas crianças que estão entre dois carros vermelhos
4284,common_voice_pt_19586228.wav,157484,a pessoa de capuz vermelho salta da pilha de pedras
3565,common_voice_pt_19441252.wav,165164,enquanto observava o planeta parecia ficar cada vez maior
4513,common_voice_pt_19860742.wav,169004,de unidade e uniformidade não havia lugar nenhum
376,common_voice_pt_19290563.wav,86828,não há cortesia em tudo
1687,common_voice_pt_19416029.wav,94508,eu não posso acreditar em mim mesmo
4056,common_voice_pt_19564249.wav,157484,pequenas falhas permitiram entrar em maior
4296,common_voice_pt_19586351.wav,134444,eu tenho estado muito ocupado nas últimas semanas
1087,common_voice_pt_19409686.wav,157484,e é melhor eu ler seus livros disse o garoto
3575,common_voice_pt_19441313.wav,99884,não era uma relação saudável
4184,common_voice_pt_19573455.wav,99884,um cachorro corre pela grama
1802,common_voice_pt_19416192.wav,88364,qual é o seu status
3576,common_voice_pt_19441314.wav,73004,mudo
1243,common_voice_pt_19410137.wav,94508,que bacana essa revista
283,common_voice_pt_19284383.wav,80684,uso efetivo da terra
3279,common_voice_pt_19435531.wav,169004,jato voando baixo sobre um campo com uma mulher no campo
2945,common_voice_pt_19433251.wav,142124,ele ouviu o vento e sentiu as pedras sob seus pés
428,common_voice_pt_19290786.wav,163628,uma pessoa corre em uma competição na frente dos espectadores
798,common_voice_pt_19317709.wav,175148,donuts são melhores com granulado de morango e café
1573,common_voice_pt_19415847.wav,129068,existem muitos tipos de materiais compostos
3691,common_voice_pt_19441771.wav,155948,por favor tente entrar em contato conosco em setembro
562,common_voice_pt_19301778.wav,84524,devo anunciar lhe
273,common_voice_pt_19284354.wav,102188,eu conheço essa voz em qualquer lugar
3319,common_voice_pt_19435594.wav,145964,suba sobre as formigas depois de amanhã
2621,common_voice_pt_19498924.wav,80684,como posso enfrentá lo
1330,common_voice_pt_19410307.wav,115244,o que o surpreendeu foi que ela ainda estava viva
2719,common_voice_pt_19588752.wav,175148,as pessoas estão se enfrentando enquanto jogam futebol
1746,common_voice_pt_19416115.wav,194348,o motorista de camelo não era um lutador e ele tinha consultado com videntes
1136,common_voice_pt_19409774.wav,169004,dois homens vestindo camisetas brancas estão trabalhando em um balcão de carne
4028,common_voice_pt_19535141.wav,122924,eu estudei c na universidade
1804,common_voice_pt_19416194.wav,125228,o gato era cinza com listras brancas
1010,common_voice_pt_19403837.wav,222764,várias pessoas assistem a uma apresentação no palco com diferentes graus de interesse
862,common_voice_pt_19318338.wav,96044,o teto desabou para dentro
3858,common_voice_pt_19455622.wav,109868,e a ingratidão não reapareceu
83,common_voice_pt_19278154.wav,106028,quanto é o seu capital nele
1188,common_voice_pt_19409887.wav,84524,todo mundo espera um minuto
2222,common_voice_pt_19422406.wav,178988,era uma emoção tão grande que suas veias estavam cheias de adrenalina
1767,common_voice_pt_19416145.wav,176684,seu braço parecia estar lutando com o que quer que estivesse no buraco
2020,common_voice_pt_19416608.wav,129068,as pessoas sob as estrelas mudam todos os dias
3568,common_voice_pt_19441270.wav,192044,sim eu dei uma cutucada nisso e não consegui descobrir o que estava errado
